id,sentence,coarse,fine,pol,asp
1762,10. There seem to be a fair number of heuristic choices throughout.,Evaluative,Evaluative,U-Neutral,Meaningful Comparison
1763,Why is IS squared in the reward for GAN training for example? Why is the scaling term required on all rewards?,Request,Request.Explanation,U-Neutral,Substance
1764,Having some guiding idea or theory for these choices or rational would be appreciated.,Request,Request.Explanation,U-Neutral,Substance
1765,11. Why is PPO introduced?,Request,Request.Explanation,U-Neutral,Substance
1766,"In algorithm 1, it is unclear how PPO would fit into this?",Request,Request.Explanation,U-Neutral,Substance
1767,More details or an alternative algorithm in the appendix would be useful.,Request,Request.Explanation,U-Neutral,Substance
1768,Why wasn't PPO used on all larger scale models? Does the training / performance of the meta-optimizer (policy gradient  vs ppo) matter?,Request,Request.Explanation,U-Neutral,Substance
1769,I would expect it would.,Other,Other,,
1770,"This detail is not discussed in this paper, and some details -- such as the learning rate for the meta-optimizer I was unable to find.",Evaluative,Evaluative,N-Negative,Clarity
1771,"12. ""It is worth noting that all GAN K:1 baselines perform worse than the rest and are skipped in Figure 2, echoing statements (Arjovsky, Gulrajani, Deng) that more updates of G than D might be preferable in GAN training.",Fact,Fact,,
1772,""" I disagree with this statement.",Evaluative,Evaluative,N-Negative,Substance
1773,"The WGAN framework is built upon a loss that can be optimized, and should be optimized, until convergence (the discriminator loss is non-saturating) -- not the reverse (more G steps than D steps) as suggested here.",Evaluative,Evaluative,N-Negative,Substance
1774,"Arjovsky does discuss issues with training D to convergence, but I don't believe there is any exploration into multiple G steps per D step as a solution.",Evaluative,Evaluative,U-Neutral,Meaningful Comparison
1775,"13. Reproducibility seems like it would be hard. There are a few parameters (meta-learning rates, meta-optimizers) that I could not find for example and there is a lot of complexity.",Evaluative,Evaluative,N-Negative,Replicability
1776,14: Claims in paper seem a little bold / overstating.,Evaluative,Evaluative,U-Neutral,Motivation/Impact
1777,"The inception gain is marginal to previous methods, and trains slower than other baselines.",Evaluative,Evaluative,U-Neutral,Substance
1778,"This is also true of MNT section -- there, the best baseline model is not even given equal training time!",Evaluative,Evaluative,U-Neutral,Substance
1779,"There are highly positive points here, such as requiring less hyperparameter search / model evaluations to find performant models.",Evaluative,Evaluative,P-Positive,Substance
1780,15. Figure 4a. Consider reformatting data (maybe histogram of differences? Or scatter plot).,Request,Request.Edit,U-Neutral,Clarity
1781,Current representation is difficult to read / parse.,Evaluative,Evaluative,N-Negative,Clarity
1783,"page 2, ""objective term. on GANs, the AutoLoss: Capital o is needed.",Request,Request.Typo,U-Neutral,Clarity
1784,Page 3: Parameter Learning heading the period is not bolded.,Request,Request.Typo,U-Neutral,Other
1785,[1] Learning step size controllers for robust neural network training.,Request,Request.Typo,U-Neutral,Other
1786,Christian Daniel et. al.,,,,
1787,[2]http://torch.ch/blog/2015/11/13/gan.html,Request,Request.Typo,U-Neutral,Other
1788,"[3] Understanding Short-Horizon Bias in Stochastic Meta-Optimization, Wu et.al.",Request,Request.Typo,U-Neutral,Other
1789,"Given the positives, and in-spite of the negatives, I would recommend to accept this paper as it discusses an interesting and novel approach when controlling multiple loss values.",Structuring,Structuring.Summary,,
1822,"The paper analyzes the strategy that a visual question answering model (FiLM) uses to verify statements containing the quantifier ""most"" (""most of the dots are red"").",Structuring,Structuring.Summary,,
1823,"It finds that the model is sensitive to the ratio of objects that satisfy the predicate (that are red) to objects that do not; as the ratio decreases (e.g. 10 red dots compared to 9 blue dots), the model's performance decreases too.",Structuring,Structuring.Summary,,
1824,This is consistent with human behavior.,Fact,Fact,,
1826,* The introduction lays out an ambitious program of comparing humans to deep neural networks.,Evaluative,Evaluative,P-Positive,Motivation/Impact
1827,* The experimental results are interesting (although of modest scope) and support the hypothesis that the network is not counting the objects but rather is using an approximation that is sensitive to the ratio between the red and non-red items.,Evaluative,Evaluative,U-Neutral,Soundness/Correctness
1829,"* The architecture of the particular model is described very briefly, and at multiple points there’s an implication that this is an investigation of “deep learning models” more generally, even though those models may vary widely.",Request,Request.Edit,N-Negative,Substance
1830,"While the authors are using an existing model, they shouldn't assume that the reader has read the paper describing that model.",Request,Request.Edit,N-Negative,Meaningful Comparison
1831,"I would like to see more discussion of whether it is at all plausible for this model to acquire the pairing strategy, compared to alternative VQA models (e.g., using relation networks).",Request,Request.Edit,U-Neutral,Meaningful Comparison
1832,* I found it difficult to follow the theoretical motivation for performing the work.,Evaluative,Evaluative,N-Negative,Motivation/Impact
1833,"The goal seems to be to test whether the network is performing the task in way that ""if not human-like, at least is cognitively plausible"".",Evaluative,Evaluative,U-Neutral,Substance
1834,I don't understand what is meant by cognitively plausible but not human-like; perhaps an example of a cognitively implausible mechanism would help clarify this issue.,Request,Request.Clarification,N-Negative,Clarity
1835,"Later in the same paragraph, the authors argue that ""in the case of a human-centered domain like natural language, ultimately, some degree of comparability to human performance is indispensable"".",Fact,Fact,,
1836,"This assertion is not justified, and seems surprising to me; we have very useful natural language processing systems that do not perform in a way that is comparable to humans (the hedge ""some degree of"" is really neither here nor there).",Evaluative,Evaluative,N-Negative,Substance
1837,"In general, I don't understand why we would want a visual question answering system that returns approximate answers --",Evaluative,Evaluative,N-Negative,Clarity
1838,isn't it better to have it count exactly how many red dots there are compared to non-red dots?,Request,Request.Experiment,U-Neutral,Soundness/Correctness
1839,"* The authors assume that explicit counting is not ""likely to be learned by the 'one-glance' feed-forward-style neural network"" evaluated in the paper. What is this statement based on? Why would a ""one-glance"" network have trouble counting objects?",Request,Request.Clarification,U-Neutral,Substance
1840,(What is a “one-glance network”?),Request,Request.Explanation,U-Neutral,Substance
1841,"* Another vague concept that is used without clarification: it is argued that if the network implements something like the Approximate Number System, that shows that it can ""learn and utilize higher-level concepts than mere pattern matching"".",Evaluative,Evaluative,N-Negative,Clarity
1842,"What is ""pattern matching"" and how does it differ from ""higher-level concepts""?",Request,Request.Clarification,U-Neutral,Substance
1843,* Why would the pairing strategy in a neural network be affected by the clustering of the objects?,Request,Request.Explanation,U-Neutral,Substance
1844,"I understand why a human who needs to saccade back and forth between the two groups of objects might lose track of the objects that have been paired so far, but I don't understand why that would affect the architecture in question.",Evaluative,Evaluative,N-Negative,Substance
1846,"* Is the definition of ""most"" really a central piece of evidence for ""the apparent importance of a cardinality concept to human cognition""? Our ability to count seems sufficient to me. Perhaps I'm not understanding what the authors have in mind here.",Request,Request.Clarification,U-Neutral,Clarity
1847,"* Please use the terms ""interpretation"" and ""verification"" consistently.",Request,Request.Edit,U-Neutral,Clarity
1848,"* ""One over the other strategy"" -> ""one strategy over the other"".",Request,Request.Typo,U-Neutral,Clarity
1849,"* The paper is almost 9 pages long, but the contribution does not appear more substantial than a standard 8-page submission.",Evaluative,Evaluative,N-Negative,Other
1850,This paper proposes an algorithm for auxiliary learning.,Structuring,Structuring.Summary,,
1851,"Given a target prediction task to be learned on training data, the auxiliary learning utilizes external training data to improve learning.",Structuring,Structuring.Summary,,
1852,"The authors focus on a setup where both target and external training data come from the same distribution but differ in class labels, where each class in the target data is a set of finer-grained classes in the auxiliary data.",Structuring,Structuring.Summary,,
1853,The authors propose a heuristic for learning from both data sets through minimization of a joint loss function.,Structuring,Structuring.Summary,,
1854,The experimental results show that the proposed methods works well on this particular setup on CIFAR data set.,Structuring,Structuring.Summary,,
1856,+ a new auxiliary learning algorithm,Evaluative,Evaluative,P-Positive,Originality
1857,+ positive results on CIFAR data set,Evaluative,Evaluative,P-Positive,Substance
1859,- novelty is low: the proposed algorithm is a heuristic similar to previously proposed algorithms in the transfer learning and auxiliary learning space,Evaluative,Evaluative,N-Negative,Originality
1860,- there is no attempt to provide a theoretical insight into the performance of the algorithm,Evaluative,Evaluative,N-Negative,Substance
1861,"- the problem assumptions are too simplistic and unrealistic (feature distributions of target and auxiliary data are identical), so it is questionable if the proposed algorithm has practical importance",Evaluative,Evaluative,N-Negative,Replicability
1862,"- experiments are performed using a synthetic setup on a single data set, so it remains unclear if the algorithm would be successful in a real life scenario",Evaluative,Evaluative,N-Negative,Replicability
1863,"- the paper is poorly written and sentences are generally very hard to parse. For example, section 3.1 is opened by statements such as ""(we use) a multi-task evaluator which trains on the principal and auxiliary tasks, and evaluates the performance of the auxiliary tasks on a meta set""??",Evaluative,Evaluative,N-Negative,Clarity
1864,The paper design a low variance gradient for distributions associated with continuous or discrete random variables.,Structuring,Structuring.Summary,,
1865,The gradient is designed in the way to approximate the  property of reparameterization gradient.,Structuring,Structuring.Summary,,
1866,The paper is comprehensive and includes mathematical details.,Structuring,Structuring.Summary,,
1867,I have following comments/questions,Structuring,Structuring.Heading,,
1868,1. What is the \kappa in “variable-nabla” stands for? What is the gradient w.r.t. \kappa?,Evaluative,Evaluative,U-Neutral,Clarity
1869,"2. In Eq(8), does the outer expectation w.r.t . y_{-v} be approximated by one sample? If so, it is using the local expectation method.",Evaluative,Evaluative,U-Neutral,Clarity
1870,How does that differs from Titsias & Lazaro-Gredilla(2015) both mathematically and experimentally?,Evaluative,Evaluative,U-Neutral,Clarity
1871,"3. Assume y_v is M-way categorical distribution, Eq(8) evaluates f by 2*V*M times which can be computationally expensive.",Evaluative,Evaluative,U-Neutral,Clarity
1872,What is the computation complexity of GO? How to explain the fast speed shown in the experiments?,Evaluative,Evaluative,U-Neutral,Clarity
1873,4. A most simple way to reduce the variance of REINFORCE gradient is to take multiple Monte-Carlo samples at the cost of more computation with multiple function f evaluations.,Fact,Fact,,
1874,"Assume GO gradient needs to evaluate f N times, how does the performance compared with the REINFORCE gradient with N Monte-Carlo samples?",Evaluative,Evaluative,U-Neutral,Clarity
1875,"5. In the discrete VAE experiment, upon brief checking the results in Grathwohl(2017), it shows validation ELBO for MNIST as (114.32,111.12), OMNIGLOT as (122.11,128.20) from which two cases are better than GO.",Evaluative,Evaluative,U-Neutral,Meaningful Comparison
1876,Does the hyper parameter setting favor the GO gradient in the reported experiments?,Evaluative,Evaluative,U-Neutral,Soundness/Correctness
1877,Error bar may also be needed for comparison.,Request,Request.Experiment,U-Neutral,Meaningful Comparison
1878,What about the performance of GO gradient in the 2 stochastic layer setting in Grathwohl(2017)?,Evaluative,Evaluative,U-Neutral,Clarity
1879,"6. The paper claims GO has less parameters than REBAR/RELAX. But in Figure 9, GO has more severe overfitting. How to explain this contradicts between the model complexity and overfitting?",Evaluative,Evaluative,U-Neutral,Clarity
1951,Overview:,Structuring,Structuring.Heading,,
1952,This paper proposes modifications to the original Differentiable Neural Computer architecture in three ways.,Structuring,Structuring.Summary,,
1953,First by introducing a masked content-based addressing which dynamically induces a key-value separation,Structuring,Structuring.Summary,,
1955,"Second, by modifying the de-allocation system by also multiplying the memory contents by a retention vector before an update",Structuring,Structuring.Summary,,
1957,"Finally, the authors propose a modification in the link distribution, through renormalization.",Structuring,Structuring.Summary,,
1958,They provide some theoretical motivation and empirical evidence that it helps avoiding memory aliasing.,Structuring,Structuring.Summary,,
1959,"The authors test their approach in the some algorithm task from the DNC paper (Copy, Associative Recall and Key-Value Retrieval), and also in the bAbi dataset.",Structuring,Structuring.Summary,,
1960,"Strengths: Overall I think the paper is well-written, and proposes simple adaptions to the DNC architecture which are theoretically grounded and could be effective for improving general performance.",Evaluative,Evaluative,P-Positive,Motivation/Impact
1961,"Although the experimental results seem promising when comparing the modified architecture to the original DNC, in my opinion there are a few fundamental problems in the empirical session (see weakness discussion bellow).",Evaluative,Evaluative,N-Negative|P-Positive,Substance|Soundness/Correctness
1962,Weaknesses: Not all model modifications are studied in all the algorithmic tasks.,Evaluative,Evaluative,N-Negative,Substance
1963,"For example, in the associative recall and key-value retrieval only DNC and DNC + masking are studied.",Structuring,Structuring.Quote,,
1964,"For the bAbi task, although there is a significant improvement (43%) in the mean error rate compared to the original DNC, it's important to note that performance in this task has improved a lot since the DNC paper was release. Since this is the only non-toy task in the paper, in my opinion, the authors have to discuss current SOTA on it, and have to cite, for example the universal transformer[1], entnet[2], relational nets [3], among others architectures that shown recent advances on this benchmark.",Request,Request.Experiment,N-Negative,Meaningful Comparison
1965,"Moreover, the sparse DNC (Rae el at., 2016) is already a much better performant in this task.",Fact,Fact,,
1966,"(mean error DNC: 16.7 \pm 7.6, DNC-MD (this paper) 9.5 \pm 1.6, sparse DNC 6.4 \pm 2.5).",,,,
1967,"Although the authors mention in the conclusion that it's future work to merge their proposed changes into the sparse DNC, it is hard to know how relevant the improvements are, knowing that there are much better baselines for this task.",Evaluative,Evaluative,N-Negative,Soundness/Correctness
1968,"It would also be good if besides the mean error rates, they reported best runs chosen by performance on the validation task, and number of the tasks solve (with < 5% error) as it is standard in this dataset.",Request,Request.Experiment,U-Neutral,Substance
1969,Smaller Notes.,Structuring,Structuring.Heading,,
1970,"1) In the abstract, I find the message for motivating the masking from the sentence  ""content based look-up results... which is not present in the key and need to be retrieved.""  hard to understand by itself. When I first read the abstract, I couldn't understand what the authors wanted to communicate with it. Later in 3.1 it became clear.",Evaluative,Evaluative,N-Negative,Clarity
1971,"2) page 3, beta in that equation is not defined",,,,
1972,3) First paragraph in page 5 uses definition of acronyms DNC-MS and DNC-MDS before they are defined.,Evaluative,Evaluative,N-Negative,Clarity
1973,"4) Table 1 difference between DNC and DNC (DM) is not clear. I am assuming it's the numbers reported in the paper, vs the author's implementation?",Request,Request.Clarification,N-Negative,Clarity
1974,"5)In session 3.1-3.3, for completeness. I think it would be helpful to explicitly compare the equations from the original DNC paper with the new proposed ones.",Request,Request.Experiment,U-Neutral,Substance
1975,--------------,Structuring,Structuring.Heading,,
1976,Post rebuttal update: I think the authors have addressed my main concern points and I am updating my score accordingly.,Structuring,Structuring.Summary,,
1977,"The paper does not really propose a new way of compressing the model weights, but rather a way of applying existing weight compression techniques.",Structuring,Structuring.Summary,,
1978,"Specifically, the proposed solution is to repeatedly apply weight compression and fine-tuning over the entire training process.",Structuring,Structuring.Summary,,
1979,"Unlike the existing work, weight compression is applied as a form of weight distortion, i.e. the model has the full degree of freedom during fine-tuning (to recover potential compression errors).",Structuring,Structuring.Summary,,
1981,"- The proposed method is shown to work with existing methods like weight pruning, low-rank compression and quantization.",Evaluative,Evaluative,P-Positive,Soundness/Correctness
1983,- The idea is a simple extension of existing work.,Evaluative,Evaluative,N-Negative,Originality
1984,"- In Table 4, it is hard to compare DeepTwist with the other methods because activation quantization is not used.",Evaluative,Evaluative,N-Negative,Substance
2007,Summary: This paper is about models for solving basic math problems.,Structuring,Structuring.Summary,,
2008,The main contribution is a synthetically generated dataset that includes a variety of types and difficulties of math problems; it is both larger and more varied than previous datasets of this type.,Structuring,Structuring.Summary,,
2009,"The dataset is then used to evaluate a number of recurrent models (LSTM, LSTM+attention, transformer); these are very powerful models for general sequence-sequence tasks, but they are not explicitly tailored to math problems.",Structuring,Structuring.Summary,,
2010,"The results are then analyzed and insights are derived explaining where neural models seemingly cope well with math tasks, and where they fall down.",Structuring,Structuring.Summary,,
2011,Strengths: I am happy to see the proposal of a very large dataset with a lot of different axes for measuring and examining the performance of models.,Evaluative,Evaluative,P-Positive,Motivation/Impact
2012,"There are challenging desiderata involved in building the training+tests sets, and the authors have an interesting and involved methodology to accomplish these.",Evaluative,Evaluative,P-Positive,Motivation/Impact
2013,"The paper is very clearly written. I'm not aware of a comparable work, so the novelty here seems good.",Evaluative,Evaluative,P-Positive,Originality
2014,"Weaknesses: The dataset created here is entirely synthetic, and the paper only includes one single small real-world case; it seems like it would be easy to generate a larger and more varied real world dataset as well (possibly from the large literature of extant solved problems in workbooks).",Evaluative,Evaluative,N-Negative,Substance
2015,It would have been useful to compare the general models here with some specific math problem-focused ones as well.,Request,Request.Experiment,N-Negative,Meaningful Comparison
2016,Some details weren't clear to me.,Evaluative,Evaluative,N-Negative,Clarity
2017,More in the comments below.,Structuring,Structuring.Heading,,
2018,"Verdict: I thought this was generally an interesting paper that has some very nice benefits, but also has some weaknesses that could be resolved. I view it as borderline, but I'm willing to change my mind based on the discussion.",Structuring,Structuring.Summary,,
2020,- One area that could stand to be improved is prior work.,Request,Request.Experiment,U-Neutral,Meaningful Comparison
2021,I'd like to see more of a discussion of *prior data sets* rather than papers proposing models for problems.,Request,Request.Experiment,U-Neutral,Meaningful Comparison
2022,"Since this is the core contribution, this should also be the main comparison.",Fact,Fact,,
2023,"For example, EMLNP 2017 paper ""Deep Neural Solver for Math Word Problems"" mentions a size 60K problem dataset.",Fact,Fact,,
2024,A more extensive discussion will help convince the readers that the proposed dataset is indeed the largest and most diverse.,Fact,Fact,,
2025,"- The authors note that previous datasets are often specific to one type of problem (i.e., single variable equation solving). Why not then combine multiple types of extant problem sets?",Request,Request.Explanation,U-Neutral,Substance
2026,- The authors divide dataset construction into crowdsourcing and synthetic.,Structuring,Structuring.Quote,,
2027,"This seems incomplete to me: there are tens of thousands (probably more) of exercises and problems available in workbooks for elementary, middle, and high school students.",Evaluative,Evaluative,N-Negative,Soundness/Correctness
2028,"These are solved, and only require very limited validation.",Fact,Fact,,
2029,They are also categorized by difficulty and area.,Fact,Fact,,
2030,"Presumably the cost here would be to physically scan some of these workbooks, but this seems like a very limited investment. Why not build datasets based on workbooks, problem solving books, etc?",Request,Request.Explanation,U-Neutral,Substance
2031,- How do are the difficulty levels synthetically determined?,Request,Request.Explanation,U-Neutral,Soundness/Correctness
2032,"- When generating the questions, the authors ""first sample the answer"". What's the distribution you use on the answer? This seems like it dramatically affects the resulting questions, so I'm curious how it's selected.",Request,Request.Explanation,U-Neutral,Soundness/Correctness
2033,- The general methodology of generating questions and ensuring that no question is too rare or too frequent and the test set is sufficiently different---these are important questions and I commend the authors for providing a strong methodology.,Request,Request.Edit,U-Neutral,Soundness/Correctness
2034,- I didn't understand the motivation for testing only very general-purpose models (this is described in Section 3).,Evaluative,Evaluative,N-Negative,Substance
2035,"This is certainly a scientific decision, i.e., the authors are determining which models to use in order to determine the possible insights they will derive.",Fact,Fact,,
2036,But it's not clear to me why testing more sophisticated models that are tailored for math questions would *not* be useful.,Request,Request.Clarification,U-Neutral,Soundness/Correctness
2037,"In fact, assuming that such methods outperform general-purpose models, we could investigate why and where this is the case (in fact the proposed dataset is very useful for this).",Fact,Fact,,
2038,"On the other hand, if these specialized approaches largely fail to outperform general-purpose models, we would have the opposite insights---that these models' benefits are dataset-specific and thus limited.",Fact,Fact,,
2039,- Really would be good to do real-world tests in a more extensive way.,Request,Request.Experiment,U-Neutral,Substance
2040,"A 40-question exam for 16 year olds is probably far too challenging for the current state of general recurrent models. Can you add some additional grades here, and more questions?",Request,Request.Edit,U-Neutral,Substance
2041,"- For the number of thinkings steps, how does it scale up as you increase it from 0 to 16? Is there a clear relationships here?",Request,Request.Explanation,U-Neutral,Clarity
2042,"- The 1+1+...+1 example is pretty intriguing, and could be a nice ""default"" question!",Fact,Fact,,
2043,"- Minor typo: in the abstract: ""test spits"" should be ""test splits""",Request,Request.Typo,U-Neutral,Clarity
2073,"edit: the authors added several experiments (better evaluation of the predicted lambda, comparison with CodeSLAM), which address my concerns.",Evaluative,Evaluative,P-Positive,Substance
